{
  "$schema": "https://json-schema.org/draft/2020-12/schema",
  "$id": "trishul-bench-results",
  "title": "TRISHUL bench/results.json",
  "type": "object",
  "required": [
    "schema_version",
    "generated_at",
    "git_commit",
    "seed",
    "environment",
    "dataset_version",
    "suite",
    "attack_success_rate",
    "attacks_blocked",
    "benign_utility",
    "p99_latency_ms",
    "suites",
    "latency",
    "voice",
    "ablation",
    "failures"
  ],
  "properties": {
    "schema_version": {
      "const": 1
    },
    "generated_at": {
      "type": "string",
      "pattern": "^\\d{4}-\\d{2}-\\d{2}T\\d{2}:\\d{2}:\\d{2}Z$"
    },
    "git_commit": {
      "type": "string"
    },
    "git_dirty": {
      "type": "boolean"
    },
    "seed": {
      "type": "integer"
    },
    "dataset_version": {
      "type": "string"
    },
    "dataset_path": {
      "type": "string"
    },
    "suite": {
      "type": "string"
    },
    "attack_success_rate": {
      "type": "number",
      "minimum": 0,
      "maximum": 100
    },
    "attacks_blocked": {
      "type": "integer",
      "minimum": 0
    },
    "benign_utility": {
      "type": "number",
      "minimum": 0,
      "maximum": 100
    },
    "p99_latency_ms": {
      "type": [
        "number",
        "null"
      ],
      "minimum": 0
    },
    "environment": {
      "type": "object",
      "required": [
        "os",
        "cpu",
        "python",
        "packages"
      ],
      "properties": {
        "os": {
          "type": "string"
        },
        "cpu": {
          "type": "string"
        },
        "python": {
          "type": "string"
        },
        "packages": {
          "type": "object",
          "additionalProperties": {
            "type": "string"
          }
        },
        "llm": {
          "type": "object",
          "required": [
            "hf_id",
            "ollama_tag",
            "digest",
            "selected_by"
          ],
          "properties": {
            "hf_id": {
              "type": "string"
            },
            "ollama_tag": {
              "type": "string"
            },
            "digest": {
              "type": "string",
              "pattern": "^[0-9a-f]{64}$"
            },
            "selected_by": {
              "type": "string"
            },
            "reader": {
              "enum": [
                "llm",
                "deterministic-fallback"
              ]
            }
          }
        }
      }
    },
    "suites": {
      "type": "object",
      "required": [
        "india",
        "agentdojo"
      ],
      "properties": {
        "india": {
          "type": "object",
          "required": [
            "attacks",
            "benign",
            "with_trishul",
            "without",
            "per_category"
          ],
          "properties": {
            "attacks": {
              "type": "integer",
              "minimum": 30
            },
            "benign": {
              "type": "integer",
              "minimum": 30
            },
            "with_trishul": {
              "$ref": "#/$defs/asr_utility"
            },
            "without": {
              "$ref": "#/$defs/asr_utility"
            },
            "with_counts": {
              "type": "object"
            },
            "per_category": {
              "type": "object",
              "minProperties": 1,
              "additionalProperties": {
                "type": "object",
                "required": [
                  "kind",
                  "metric",
                  "n",
                  "with_trishul",
                  "without"
                ],
                "properties": {
                  "kind": {
                    "enum": [
                      "attack",
                      "benign"
                    ]
                  },
                  "metric": {
                    "enum": [
                      "asr",
                      "utility"
                    ]
                  },
                  "n": {
                    "type": "integer",
                    "minimum": 1
                  },
                  "with_trishul": {
                    "$ref": "#/$defs/cat_side"
                  },
                  "without": {
                    "$ref": "#/$defs/cat_side"
                  }
                }
              }
            }
          }
        },
        "agentdojo": {
          "type": "object",
          "required": [
            "status",
            "reason",
            "model",
            "suites_run",
            "subset_note"
          ],
          "properties": {
            "status": {
              "enum": [
                "ok",
                "not_run"
              ]
            },
            "reason": {
              "type": "string"
            },
            "model": {
              "type": [
                "string",
                "null"
              ]
            },
            "suites_run": {
              "type": "array",
              "items": {
                "type": "string"
              }
            },
            "subset_note": {
              "type": "string"
            },
            "with_trishul": {
              "oneOf": [
                {
                  "type": "null"
                },
                {
                  "$ref": "#/$defs/asr_utility"
                }
              ]
            },
            "without": {
              "oneOf": [
                {
                  "type": "null"
                },
                {
                  "$ref": "#/$defs/asr_utility"
                }
              ]
            }
          },
          "allOf": [
            {
              "if": {
                "properties": {
                  "status": {
                    "const": "not_run"
                  }
                }
              },
              "then": {
                "properties": {
                  "reason": {
                    "minLength": 1
                  }
                }
              }
            },
            {
              "if": {
                "properties": {
                  "status": {
                    "const": "ok"
                  }
                }
              },
              "then": {
                "properties": {
                  "with_trishul": {
                    "type": "object"
                  },
                  "without": {
                    "type": "object"
                  },
                  "model": {
                    "type": "string"
                  }
                }
              }
            }
          ]
        }
      }
    },
    "latency": {
      "type": "object",
      "required": [
        "ml_on",
        "ml_off",
        "samples"
      ],
      "properties": {
        "ml_on": {
          "$ref": "#/$defs/stages"
        },
        "ml_off": {
          "$ref": "#/$defs/stages"
        },
        "samples": {
          "type": "integer",
          "minimum": 1
        }
      }
    },
    "voice": {
      "type": "object",
      "required": [
        "status",
        "source",
        "eer",
        "accuracy",
        "note"
      ],
      "properties": {
        "status": {
          "enum": [
            "measured",
            "partial",
            "not_run"
          ]
        },
        "source": {
          "enum": [
            "bench/voice.json",
            "bench/voice.json+bench/voice_eer.json"
          ]
        },
        "eer": {
          "type": [
            "number",
            "null"
          ],
          "minimum": 0,
          "maximum": 1
        },
        "accuracy": {
          "type": [
            "number",
            "null"
          ],
          "minimum": 0,
          "maximum": 1
        },
        "note": {
          "type": "string"
        }
      }
    },
    "ablation": {
      "type": "array",
      "minItems": 3,
      "items": {
        "type": "object",
        "required": [
          "config",
          "asr",
          "utility"
        ],
        "properties": {
          "config": {
            "enum": [
              "rules_only",
              "rules_classifier",
              "full"
            ]
          },
          "asr": {
            "type": [
              "number",
              "null"
            ],
            "minimum": 0,
            "maximum": 1
          },
          "utility": {
            "type": [
              "number",
              "null"
            ],
            "minimum": 0,
            "maximum": 1
          }
        }
      }
    },
    "failures": {
      "type": "array",
      "items": {
        "type": "object",
        "required": [
          "id",
          "kind",
          "detail"
        ],
        "properties": {
          "id": {
            "type": "string"
          },
          "kind": {
            "enum": [
              "harness_error",
              "attack_succeeded",
              "benign_blocked"
            ]
          },
          "detail": {
            "type": "string"
          }
        }
      }
    }
  },
  "$defs": {
    "asr_utility": {
      "type": "object",
      "required": [
        "asr",
        "utility"
      ],
      "properties": {
        "asr": {
          "type": [
            "number",
            "null"
          ],
          "minimum": 0,
          "maximum": 1
        },
        "utility": {
          "type": [
            "number",
            "null"
          ],
          "minimum": 0,
          "maximum": 1
        }
      }
    },
    "cat_side": {
      "type": "object",
      "required": [
        "rate",
        "measured"
      ],
      "properties": {
        "rate": {
          "type": [
            "number",
            "null"
          ],
          "minimum": 0,
          "maximum": 1
        },
        "measured": {
          "type": "integer",
          "minimum": 0
        }
      }
    },
    "stages": {
      "type": "object",
      "minProperties": 1,
      "additionalProperties": {
        "type": "object",
        "required": [
          "p50",
          "p99"
        ],
        "properties": {
          "p50": {
            "type": "number",
            "minimum": 0
          },
          "p99": {
            "type": "number",
            "minimum": 0
          }
        }
      }
    }
  }
}
